{
  "claim_id": "edge-pending-claim",
  "statement": "處理組的 score 高於基準組",
  "experiment_id": "edge-exp",
  "comparison_ref": "records/experiments/comparisons/edge-good-run__edge-good-run-2.json",
  "estimand_id": "effect.primary",
  "expected_direction": "increase",
  "expected_conclusion": "inconclusive",
  "scope": "僅限這個資料集",
  "created_at": "2026-01-08T05:30:00Z",
  "claim_type": "comparative",
  "status": "candidate"
}
